{
  "project": {
    "name": "Smith Kitchen Remodel",
    "client": "John Smith",
    "job_number": "2026-0047",
    "room": "kitchen",
    "units": "inches",
    "date": "2026-03-21",
    "notes": "Single wall layout per AI wireframe. Face frame, shaker, painted white."
  },

  "defaults": {
    "construction": "face_frame",
    "box_material": "3/4 birch plywood",
    "box_thickness": 0.75,
    "back_panel": {
      "material": "1/4 birch plywood",
      "thickness": 0.25,
      "method": "dado"
    },
    "face_frame": {
      "material": "poplar",
      "stile_width": 1.5,
      "rail_width": 1.5,
      "attachment": "pocket_screw"
    },
    "door": {
      "style": "shaker",
      "overlay": "full",
      "material": "MDF shaker door",
      "thickness": 0.75,
      "reveal": 0.125
    },
    "drawer": {
      "box_material": "1/2 Baltic birch",
      "box_thickness": 0.5,
      "bottom_thickness": 0.25,
      "slide_type": "undermount",
      "slide_extension": "full",
      "soft_close": true,
      "joinery": "dovetail"
    },
    "hinge": {
      "type": "concealed_euro",
      "soft_close": true,
      "opening_angle": 110,
      "count_per_door": "auto"
    },
    "hardware": {
      "pull_type": "bar",
      "pull_size": 5,
      "pull_finish": "brushed_nickel",
      "pull_position": "upper_door_bottom"
    },
    "finish": {
      "type": "paint",
      "color": "BM Simply White OC-117",
      "sheen": "satin",
      "species": "poplar"
    },
    "toe_kick": {
      "height": 4.5,
      "depth": 3,
      "type": "separate",
      "material": "3/4 plywood"
    },
    "shelf": {
      "material": "3/4 birch plywood",
      "thickness": 0.75,
      "adjustable": true,
      "pin_type": "5mm",
      "pin_spacing": 1.25,
      "edge_band": true
    },
    "standard_depths": {
      "base": 24,
      "wall": 12,
      "tall": 24,
      "vanity": 21,
      "desk": 24
    },
    "standard_heights": {
      "base": 34.5,
      "wall": 30,
      "tall": 84,
      "vanity": 34.5
    }
  },

  "runs": [
    {
      "id": "run_1",
      "label": "Main Wall",
      "wall_length": 132,
      "origin": { "x": 0, "y": 0, "z": 0 },
      "direction": 0,

      "countertop": {
        "material": "quartz",
        "thickness": 1.25,
        "overhang_front": 1.5,
        "overhang_sides": 1,
        "backsplash": {
          "height": 4,
          "material": "quartz",
          "full_height": false
        },
        "edge_profile": "eased",
        "cutouts": [
          {
            "type": "sink",
            "offset_from_left": 48,
            "width": 33,
            "depth": 22
          }
        ]
      },

      "cabinets": [
        {
          "id": "B1",
          "type": "base",
          "label": "Base Single Door Left End",
          "row": "base",
          "width": 18,
          "face": {
            "sections": [
              { "type": "drawer", "count": 1, "height": 6 },
              { "type": "door", "count": 1, "hinge_side": "left" }
            ]
          },
          "interior": { "shelves": 1 },
          "end_panels": { "left": "applied" }
        },
        {
          "id": "B2",
          "type": "base_sink",
          "label": "Sink Base",
          "row": "base",
          "width": 36,
          "face": {
            "sections": [
              { "type": "false_front", "count": 1, "height": 6 },
              { "type": "door", "count": 2 }
            ]
          },
          "interior": { "shelves": 0, "accessories": ["pull_out_waste", "pull_out_recycling"] }
        },
        {
          "id": "B3",
          "type": "base",
          "label": "Base Double Door Center",
          "row": "base",
          "width": 33,
          "face": {
            "sections": [
              { "type": "drawer", "count": 1, "height": 6 },
              { "type": "door", "count": 2 }
            ]
          },
          "interior": { "shelves": 1, "rollouts": 1 }
        },
        {
          "id": "B4",
          "type": "base_drawer_bank",
          "label": "4-Drawer Bank",
          "row": "base",
          "width": 18,
          "face": {
            "sections": [
              { "type": "drawer", "count": 1, "height": 6 },
              { "type": "drawer", "count": 1, "height": 6 },
              { "type": "drawer", "count": 1, "height": 8 },
              { "type": "drawer", "count": 1, "height": 10 }
            ]
          },
          "interior": { "accessories": ["cutlery_divider"] }
        },
        {
          "id": "B5",
          "type": "base_spice",
          "label": "Spice Pull-Out",
          "row": "base",
          "width": 9,
          "face": {
            "sections": [
              { "type": "door", "count": 1, "hinge_side": "none" }
            ]
          },
          "interior": { "accessories": ["spice_insert"] },
          "end_panels": { "right": "applied" },
          "notes": "Full-height single pull-out with 4 shelves. No hinge — pull-out mechanism."
        },

        {
          "id": "W1",
          "type": "wall",
          "label": "Wall Tall Glass Left",
          "row": "wall",
          "width": 15,
          "height": 42,
          "face": {
            "sections": [
              { "type": "glass_door", "count": 1, "hinge_side": "left", "mullion_pattern": "vertical_center", "insert": "glass_clear" }
            ]
          },
          "interior": { "shelves": 3 }
        },
        {
          "id": "W2",
          "type": "wall",
          "label": "Wall Tall Glass Right",
          "row": "wall",
          "width": 15,
          "height": 42,
          "face": {
            "sections": [
              { "type": "glass_door", "count": 1, "hinge_side": "right", "mullion_pattern": "vertical_center", "insert": "glass_clear" }
            ]
          },
          "interior": { "shelves": 3 }
        },
        {
          "id": "W3",
          "type": "wall",
          "label": "Wall Double Door Left",
          "row": "wall",
          "width": 30,
          "height": 30,
          "face": {
            "sections": [
              { "type": "door", "count": 2 }
            ]
          },
          "interior": { "shelves": 2 }
        },
        {
          "id": "W4",
          "type": "wall_bridge",
          "label": "Bridge Cabinet Over Range",
          "row": "wall",
          "width": 30,
          "height": 15,
          "face": {
            "sections": [
              { "type": "door", "count": 2 }
            ]
          },
          "interior": { "shelves": 0 },
          "notes": "Mounts above hood. Verify clearance to cooking surface per code — 30in min for gas."
        },
        {
          "id": "W5",
          "type": "wall",
          "label": "Wall Single Right",
          "row": "wall",
          "width": 18,
          "height": 30,
          "face": {
            "sections": [
              { "type": "door", "count": 1, "hinge_side": "right" }
            ]
          },
          "interior": { "shelves": 2 }
        },
        {
          "id": "W6",
          "type": "wall",
          "label": "Wall Small Square Far Right",
          "row": "wall",
          "width": 15,
          "height": 15,
          "face": {
            "sections": [
              { "type": "door", "count": 1, "hinge_side": "left" }
            ]
          },
          "interior": { "shelves": 0 },
          "notes": "Above-counter short cabinet — possibly above a coffee station or small appliance."
        }
      ],

      "fillers": [
        { "position": "before_first", "width": 1.5, "scribe": true },
        { "position": "after_last", "width": 1.5, "scribe": true }
      ],

      "trim": {
        "crown": {
          "profile": "classic ogee",
          "height": 3,
          "spring_angle": 45,
          "build_up": false
        },
        "light_rail": {
          "profile": "simple cove",
          "height": 1.5
        }
      }
    }
  ],

  "appliance_openings": []
}
